audio_file|text
0007/Happy/0007_000734.wav|那是马特，他肯定很勇敢。
0007/Happy/0007_000996.wav|赌博往往是个祸根，
0007/Happy/0007_000728.wav|没错，就是车门。另外两个人问他说
0007/Happy/0007_000716.wav|他一定是一眼就被你迷住了。
0007/Happy/0007_001046.wav|好好休息一下，这个小木棍叫梯。
0007/Happy/0007_000870.wav|这样你就有时间挥拍打球了。
0007/Happy/0007_000971.wav|很大，令人兴奋但是嘈杂。
0007/Happy/0007_000767.wav|你深深地印在我的脑海里。
0007/Happy/0007_000702.wav|英国的哲学家曾经说过“
0007/Happy/0007_000720.wav|前几天我碰见了一件有趣的事儿。
0007/Happy/0007_000877.wav|你在我的心里折腾好久了。
0007/Happy/0007_000995.wav|文学和经济，我喜欢很多著作。
0007/Happy/0007_000821.wav|那你就离市区很远了。
0007/Happy/0007_000888.wav|以后我要经常来这儿爬山。
0007/Happy/0007_000799.wav|得了吧，别这么胆小啦。
0007/Happy/0007_000779.wav|人们当然都叫他“奥林匹克之父”。
0007/Happy/0007_000879.wav|她和维克分手了，所以她申请转调。
0007/Happy/0007_000853.wav|我们还等什么
0007/Happy/0007_000768.wav|我应该给女朋友买玫瑰花的。
0007/Happy/0007_001030.wav|我们相处得很好，仅此而已。
0007/Happy/0007_000811.wav|每天早晨都是我妈妈帮他系的。
0007/Happy/0007_000856.wav|承蒙邀请参加你的婚礼。
0007/Happy/0007_000938.wav|我不这么认为。我们沿着小溪走。
0007/Happy/0007_000712.wav|你每次谈恋爱都像现在这样。
0007/Happy/0007_000824.wav|是的，请返还我的钱，谢谢。
0007/Happy/0007_001021.wav|不是很喜欢，你把我绕晕了。
0007/Happy/0007_000744.wav|比方说，“华尔街日报”就很好。
0007/Happy/0007_000988.wav|我随时都在，有没有梦到我。
0007/Happy/0007_000760.wav|坐地铁只需要大约二十分钟。
0007/Happy/0007_000931.wav|最近很冷，风又大。
0007/Happy/0007_000872.wav|我是个学生，服务器响应超时。
0007/Happy/0007_000858.wav|我的性格就是冷静并且客观。
0007/Happy/0007_000893.wav|带女友出去好好吃上一顿。
0007/Happy/0007_000806.wav|做不了什么，通常我会保持沉默。
0007/Happy/0007_000866.wav|我想那些应该是草莓的种子。
0007/Happy/0007_001018.wav|下午好，蒂娜，我想我问错人了。
0007/Happy/0007_000864.wav|我曾在一家船运公司里面做过六年。
0007/Happy/0007_000967.wav|这可是我学会的第一首古诗。
0007/Happy/0007_000840.wav|我也知道自己是大嘴巴。
0007/Happy/0007_000789.wav|是个冰淇淋，桃花确实很漂亮。
0007/Happy/0007_000762.wav|我是顺路过来跟你告别的。
0007/Happy/0007_000963.wav|也许反倒是件好事
0007/Happy/0007_000897.wav|为什么不，交朋友不分性别。
0007/Happy/0007_001039.wav|不要乱问女孩子的年龄。
0007/Happy/0007_000998.wav|祝你春节快乐，全家幸福安康。
0007/Happy/0007_000999.wav|是的，我刚撞到了桌子。
0007/Happy/0007_000809.wav|我其实挺饿的。
0007/Happy/0007_000983.wav|我想所有中国人都会打乒乓球。
0007/Happy/0007_001014.wav|现在全城的人都要向我借钱了！
0007/Happy/0007_000886.wav|软妹子生气会说：讨厌，不理你啦。
0007/Happy/0007_000954.wav|我没有忽悠你，机器人不会忽悠。
0007/Happy/0007_000805.wav|我们俩合不来，还经常吵架。
0007/Happy/0007_000977.wav|是的，所以我永不喝它的。
0007/Happy/0007_000764.wav|我告退了，晚上回去拍给你。
0007/Happy/0007_001003.wav|我一直到清晨四点才到家，
0007/Happy/0007_001035.wav|他们将于今年夏天结婚。
0007/Happy/0007_000756.wav|我参加了一个有关全球变暖的集会，
0007/Happy/0007_000862.wav|原来你也在玩这个
0007/Happy/0007_000874.wav|他在这次竞选活动中花了数百万，
0007/Happy/0007_001049.wav|是的，真是名副其实。
0007/Happy/0007_000868.wav|你得先回答我，你最喜欢谁。
0007/Happy/0007_000965.wav|我必须再次感谢您的慷慨相助。
0007/Happy/0007_000907.wav|我是萌萌哒，你是呆呆哒。
0007/Happy/0007_000887.wav|我们一起为他办个惊喜派对。
0007/Happy/0007_001023.wav|他对谁都那么友好。
0007/Happy/0007_000718.wav|我们意见不和，咱们去那儿玩吧。
0007/Happy/0007_000743.wav|这样的话，我们可以选择青年旅馆。
0007/Happy/0007_000731.wav|没听清，请问什么时间提醒你。
0007/Happy/0007_000815.wav|真是个好习惯，通常看书或消遣。
0007/Happy/0007_000875.wav|她此刻失业了，你最好不要惹她。
0007/Happy/0007_001019.wav|家里有全自动洗衣机。
0007/Happy/0007_000910.wav|也不算，她有的歌我都挺喜欢的，
0007/Happy/0007_000885.wav|今天真凉快，我希望主队输掉。
0007/Happy/0007_000876.wav|带上你的家人，但是他有丑闻。
0007/Happy/0007_000924.wav|这个对我来说有点难！
0007/Happy/0007_000730.wav|除非你打飞碟球，但这是不可能的。
0007/Happy/0007_001027.wav|我讨厌吃醋，偶是不懂，你懂。
0007/Happy/0007_000892.wav|如果我滚远了我就回不来了。
0007/Happy/0007_000927.wav|我真受不了城里那么大的噪音。
0007/Happy/0007_000863.wav|我还不知道你认识弗兰克。
0007/Happy/0007_000745.wav|我知道人生并不总是一帆风顺，
0007/Happy/0007_000975.wav|然后再找一个音乐播放器，
0007/Happy/0007_000914.wav|当然，我简直离开音乐就不能活，
0007/Happy/0007_000834.wav|多教我些东西我会更聪明。
0007/Happy/0007_001045.wav|别总是闲着，找点事情干。
0007/Happy/0007_000895.wav|我以为你们国家的人都是麻将高手。
0007/Happy/0007_000732.wav|我遇到了一位漂亮的女孩。
0007/Happy/0007_000733.wav|我是青蛙，不用冬眠的。
0007/Happy/0007_000808.wav|让我们看看哪一种球技比较好。
0007/Happy/0007_000891.wav|别问了！说多了都是眼泪！
0007/Happy/0007_000969.wav|是很棒的一款手机，性价比超级高。
0007/Happy/0007_000962.wav|他好像是被他女友给甩了。
0007/Happy/0007_000929.wav|这个位置不错，下车。
0007/Happy/0007_000932.wav|我最近正在努力练习棋艺。
0007/Happy/0007_000735.wav|这样无辜的人就不会被杀了。
0007/Happy/0007_000780.wav|看呀，我们差不多就装饰好了。
0007/Happy/0007_000985.wav|自己保重，记得要常联系。
0007/Happy/0007_000802.wav|我昨天遇到马克，他看起来很忧郁。
0007/Happy/0007_000816.wav|没有，不过，我们去了肯尼迪中心。
0007/Happy/0007_000916.wav|碰到喜欢的女孩子要主动。
0007/Happy/0007_001034.wav|我曾经养过，我太高兴了。
0007/Happy/0007_001038.wav|年轻人当然要承担责任，
0007/Happy/0007_000980.wav|绝对不可以走到湖的中央。
0007/Happy/0007_000748.wav|时候不早了，我来了，请指示。
0007/Happy/0007_000860.wav|当然！他是我们大学的班长。
0007/Happy/0007_000949.wav|我最好的朋友就约会过。
0007/Happy/0007_000790.wav|还不太糟糕，但是得躺在床上。
0007/Happy/0007_000925.wav|差不多，我们俩都很热情随和。
0007/Happy/0007_000896.wav|我饿啦，我想去吃点东西。
0007/Happy/0007_000761.wav|下个月我姐姐要结婚了。
0007/Happy/0007_001005.wav|我支持你。它是需要重做。
0007/Happy/0007_001029.wav|但是有时夏天比其它季节更迷人。
0007/Happy/0007_000717.wav|很快你上大学就用得到了。
0007/Happy/0007_000968.wav|谁都有烦的时候。
0007/Happy/0007_000839.wav|他们的配合值得我们学习
0007/Happy/0007_000763.wav|你知道我很努力地在戒酒。
0007/Happy/0007_000941.wav|请勿进入竹林。不让进。
0007/Happy/0007_000707.wav|我每个月打一次电话。
0007/Happy/0007_000976.wav|我当然喜欢，我很注意颜面。
0007/Happy/0007_000750.wav|每次叫我都不给红包，不开心。
0007/Happy/0007_000958.wav|这句话的意义我不太明白。
0007/Happy/0007_000709.wav|就是这个意思，你又聪明又好看。
0007/Happy/0007_000955.wav|最初我的工作是当一名佣人。
0007/Happy/0007_000777.wav|奏婚礼进行曲了，他们过来了。
0007/Happy/0007_001028.wav|我们下午可以在湖里划船。
0007/Happy/0007_001008.wav|我去查查篮球相关的知识。
0007/Happy/0007_000791.wav|如果有我能帮忙的请告诉我。
0007/Happy/0007_000966.wav|我是淑女，只会讲文明用语。
0007/Happy/0007_000943.wav|那样的话你应该穿讲究一点。
0007/Happy/0007_001009.wav|已经怀孕四个半月了，
0007/Happy/0007_000738.wav|当然是了，我现在快饿死了。
0007/Happy/0007_000952.wav|我是个游戏迷。
0007/Happy/0007_000978.wav|我真兴奋，我终于有了自己的庭院了。
0007/Happy/0007_000964.wav|听起来很厉害的样子！
0007/Happy/0007_001047.wav|这两块是唐朝不同时期铸造的。
0007/Happy/0007_000911.wav|我对养花已经厌倦了。
0007/Happy/0007_000940.wav|大约一个小时左右。
0007/Happy/0007_000765.wav|一点也不差，先把握好现在吧。
0007/Happy/0007_000960.wav|我很伤心，我准备去网吧。
0007/Happy/0007_000987.wav|我太喜欢听了，所以不断重复着听。
0007/Happy/0007_000755.wav|它实际会形成一氧化碳，
0007/Happy/0007_000937.wav|雪下得真大，带着我去购物。
0007/Happy/0007_000922.wav|我的老朋友汉森就住在伦敦。
0007/Happy/0007_000835.wav|我要学习一下相关知识。
0007/Happy/0007_000822.wav|汤姆是个好人，但却赌博成瘾，
0007/Happy/0007_000997.wav|三个，两个儿子一个女儿。
0007/Happy/0007_000776.wav|是的，你是个大块头，我是守门员。
0007/Happy/0007_000945.wav|贾尼斯突然兴奋地大叫起来。
0007/Happy/0007_001037.wav|你看起来很高兴，眼睛闪闪发亮。
0007/Happy/0007_000781.wav|这个镇上所有的人都喜欢扯闲话。
0007/Happy/0007_000942.wav|为了不让鱼吃掉诗人的身体。
0007/Happy/0007_001041.wav|我会在你的脸上画鬼脸。
0007/Happy/0007_000953.wav|你比吴亦凡帅，我同意你的观点。
0007/Happy/0007_000818.wav|你的同学把你给捉弄了吧。
0007/Happy/0007_000961.wav|这可真不像是场英超比赛。
0007/Happy/0007_000793.wav|别不好意思。再多吃些鸡肉。
0007/Happy/0007_000812.wav|那棒极了，其实心情挺不错。
0007/Happy/0007_001000.wav|这个我相信，我是登山爱好者。
0007/Happy/0007_000705.wav|我们乘船漂游了三峡，真是刺激。
0007/Happy/0007_001010.wav|这局我让你开，今天我不想错过。
0007/Happy/0007_001050.wav|是很难听的脏话，主人可别学了。
0007/Happy/0007_000913.wav|裁判全给了满分。
0007/Happy/0007_001042.wav|我缺钱用，所以上星期把它当了。
0007/Happy/0007_000706.wav|我喜欢“北京欢迎你”。
0007/Happy/0007_000795.wav|我倒是有一个爱好——收藏古董。
0007/Happy/0007_000838.wav|我总是控制不了它。
0007/Happy/0007_000852.wav|小心脚下。人行道上有个坑。
0007/Happy/0007_000826.wav|不是，他住在沃斯盾的老房子里。
0007/Happy/0007_000714.wav|谁你也不认识，我很乐意帮助你。
0007/Happy/0007_000994.wav|我是银灰色的，我都被你说饿了。
0007/Happy/0007_000859.wav|我不会牺牲我的健康来换取金钱的。
0007/Happy/0007_000982.wav|有些人划船，有的人在进行花草活动
0007/Happy/0007_000832.wav|是你最牵挂的那个女人。
0007/Happy/0007_000751.wav|没关系，也许他老婆会泄露秘密！
0007/Happy/0007_000926.wav|你要做爸爸了，真让人难以相信。
0007/Happy/0007_000708.wav|沙尘暴好像给每个人都带来了麻烦！
0007/Happy/0007_000944.wav|我的直系亲属人数不多。
0007/Happy/0007_000820.wav|你还真是考虑周到。
0007/Happy/0007_001006.wav|我在一个机械化农场做工程师。
0007/Happy/0007_000783.wav|你身上的每一点都吸引着我。
0007/Happy/0007_000771.wav|只要令人鼓舞的电影我都喜欢。
0007/Happy/0007_001022.wav|等待你的指令，随时可为你效劳。
0007/Happy/0007_000906.wav|是的，我知道，患难见真情。
0007/Happy/0007_000758.wav|让人看上去就感到宽广，气魄非凡。
0007/Happy/0007_000828.wav|这些颜色也不太适合你。
0007/Happy/0007_000991.wav|在法国南部，气候常年舒适宜人。
0007/Happy/0007_000796.wav|别小看我这发型！我还蛮喜欢的。
0007/Happy/0007_000721.wav|已经播至该专辑最后一个声音。
0007/Happy/0007_000970.wav|没有找到你想删除的闹钟。
0007/Happy/0007_000833.wav|是不是依然觉得我很可爱。
0007/Happy/0007_000905.wav|还要叫她起床，怎么会不早起。
0007/Happy/0007_000984.wav|有充足的时间购物和观光。
0007/Happy/0007_000787.wav|是没什么但是挺别扭的。
0007/Happy/0007_000784.wav|他好像跟他的秘书有过一腿。
0007/Happy/0007_000825.wav|如果你想要纹身，你去纹好了。
0007/Happy/0007_000986.wav|门儿都没有，现在还不会。
0007/Happy/0007_000921.wav|我非常支持人们走进太空。
0007/Happy/0007_000817.wav|快点起床，我在公寓门口等你。
0007/Happy/0007_000855.wav|我只打算放松一下自己。
0007/Happy/0007_000973.wav|但梅花往往被很多人忽视。
0007/Happy/0007_000918.wav|明天是星期天，我们去透透气吧。
0007/Happy/0007_000900.wav|我已经习惯这种气候了。
0007/Happy/0007_000890.wav|上海现在是下午四点三十六分。
0007/Happy/0007_000993.wav|振作点儿，我看了屏幕显示！
0007/Happy/0007_000957.wav|这是我在旅游第四天拍的。
0007/Happy/0007_001025.wav|尽管提意见，我会改正的。
0007/Happy/0007_000928.wav|好的。新的音乐厅有一场音乐会。
0007/Happy/0007_000792.wav|不会这么凑巧吧！我也是十六。
0007/Happy/0007_000830.wav|我的希望是工作到倒下的那一天。
0007/Happy/0007_001026.wav|这么多笑话，一天讲不完！
0007/Happy/0007_000959.wav|我们想等一个合适的时候。
0007/Happy/0007_000908.wav|你可以在那儿呆上至少一整天。
0007/Happy/0007_000947.wav|没有为什么就是要等我。
0007/Happy/0007_000939.wav|食物也很美味，更不用提价钱了。
0007/Happy/0007_000778.wav|它们的设计外形小巧，可单手操作。
0007/Happy/0007_000912.wav|我还会陪你一路走下去。
0007/Happy/0007_000737.wav|我和我的妻子盼望着和您见面。
0007/Happy/0007_000946.wav|领带对男人来说真必不可少。
0007/Happy/0007_000726.wav|是的，他很狡猾，经常陷害他人。
0007/Happy/0007_000749.wav|递给我一些彩球和纸花。
0007/Happy/0007_000769.wav|以后不要喝那么多了，伤身体。
0007/Happy/0007_000754.wav|我是基于人工智能系统被创造的。
0007/Happy/0007_000851.wav|我也最喜欢你，不要开枪。我投降
0007/Happy/0007_000729.wav|很可爱啊，就像你一样。
0007/Happy/0007_000757.wav|跳舞好难呀，我还正在练基本功。
0007/Happy/0007_000845.wav|听大自然的声响，就像听音乐一样！
0007/Happy/0007_000701.wav|打远一看，它们的确很是美丽，
0007/Happy/0007_001004.wav|我刚从苏格兰回来。
0007/Happy/0007_000739.wav|没有找到日程，走的时候请锁门。
0007/Happy/0007_000935.wav|我爱运动，但是对篮球玩得不多。
0007/Happy/0007_000871.wav|你这个小气鬼，很不幸，非常少。
0007/Happy/0007_000736.wav|我必须一直通电才能工作。
0007/Happy/0007_001011.wav|我们休息一下喝杯咖啡。
0007/Happy/0007_001040.wav|每天晚上跟你互道晚安真幸福。
0007/Happy/0007_001043.wav|许多白领都参加到这个游戏里面，
0007/Happy/0007_000813.wav|玛丽，你看来很喜欢挖苦我。
0007/Happy/0007_000880.wav|冬天雨非常多。我不喜欢雨天。
0007/Happy/0007_000747.wav|这是台湾地区最大的动物园。
0007/Happy/0007_000741.wav|姐忙得很，没空和你说这个。
0007/Happy/0007_000904.wav|你昨天才买衣服，真是一购物狂。
0007/Happy/0007_000788.wav|香港海洋公园，主人快带我去。
0007/Happy/0007_000704.wav|不管怎么说主队好象是志在夺魁。
0007/Happy/0007_000917.wav|他的收支几乎不能平衡。
0007/Happy/0007_000902.wav|那就一会再说，我好害怕。
0007/Happy/0007_000752.wav|你不应该害怕开始一段新的感情。
0007/Happy/0007_001020.wav|谢谢你来这里，告诉我详细一些。
0007/Happy/0007_001012.wav|如果她拒绝我，我会死的。
0007/Happy/0007_000841.wav|你可以去问鹦鹉啊，鹦鹉会说话。
0007/Happy/0007_000723.wav|做一些好吃的促进宝宝的食欲。
0007/Happy/0007_000899.wav|我喜欢你的干净整洁，阳光开朗。
0007/Happy/0007_000956.wav|陪你度过这漫长的黑夜。
0007/Happy/0007_000861.wav|他讲的笑话让我笑个不停。
0007/Happy/0007_000869.wav|让我再想想，真相已经上传了。
0007/Happy/0007_000742.wav|我会暖被窝了，逗你的。
0007/Happy/0007_001024.wav|我喜欢吃中餐。
0007/Happy/0007_001048.wav|我喜欢你的黑衣服，你的尖牙真酷。
0007/Happy/0007_000827.wav|你说我们在芝加哥要待三天的。
0007/Happy/0007_000823.wav|那你就说你为之神魂颠倒了。
0007/Happy/0007_001017.wav|你看上去比以前更漂亮了。
0007/Happy/0007_000850.wav|这样子比较有趣。
0007/Happy/0007_000889.wav|我是一名教师，你可是好眼光。
0007/Happy/0007_000774.wav|今年应该是第二十七个教师节。
0007/Happy/0007_000878.wav|你转一个，我想学习下。
0007/Happy/0007_000909.wav|对不起我把咖啡洒在桌布上了。
0007/Happy/0007_000933.wav|拜托，别跟我提到笔记本电脑。
0007/Happy/0007_000857.wav|你知道，有时候病人会不讲理。
0007/Happy/0007_000883.wav|你绝对猜不到她准备要孩子了。
0007/Happy/0007_000766.wav|我们可以去钓鱼、聊天还有野营。
0007/Happy/0007_000722.wav|我和我朋友刚从巴厘岛回来。
0007/Happy/0007_000920.wav|所以你必须要坚持，时间越长越好。
0007/Happy/0007_000894.wav|炖肉一小时，剩余三十分钟十八秒。
0007/Happy/0007_000759.wav|只要是我能玩好的，我都喜欢。
0007/Happy/0007_000842.wav|是啊，我还是个乳臭未干的小记者。
0007/Happy/0007_000882.wav|大概足够支持我生活三个月的。
0007/Happy/0007_000782.wav|听说你要去香港看你叔叔。
0007/Happy/0007_000746.wav|我们可以轮流开车。
0007/Happy/0007_000979.wav|我想说我也这样认为的。
0007/Happy/0007_000753.wav|我肯定会的，那以后我不问了。
0007/Happy/0007_000867.wav|太妙了，我想换一些日元。
0007/Happy/0007_000770.wav|心动不如行动，我不太擅长卖萌。
0007/Happy/0007_000865.wav|其实我们前天已经分手了。
0007/Happy/0007_000972.wav|沈阳明天有雷阵雨，多云转晴。
0007/Happy/0007_000837.wav|也许能帮助你把事情弄清楚。
0007/Happy/0007_000724.wav|你的身影总是在我心里晃来晃去。
0007/Happy/0007_000810.wav|自己的事情要自己做。
0007/Happy/0007_000990.wav|还有聊天记录。
0007/Happy/0007_000881.wav|时间对珍尼来说是没有用的。
0007/Happy/0007_000848.wav|有事记得喊我。
0007/Happy/0007_000948.wav|我不怎么在乎这个店有没有名。
0007/Happy/0007_000819.wav|不过我想星期五走，
0007/Happy/0007_000873.wav|一套古瓷器。它真的很珍贵。
0007/Happy/0007_000930.wav|那不打扰你了，我不敢约出去。
0007/Happy/0007_000800.wav|就经常去我们宿舍附近的酒吧。
0007/Happy/0007_000775.wav|我也想去看可爱的熊猫。
0007/Happy/0007_000725.wav|我觉得并不是非要有特别的品质。
0007/Happy/0007_000847.wav|不知道。或许一双新鞋。
0007/Happy/0007_000901.wav|也就是一大堆照片。
0007/Happy/0007_000807.wav|我的表两点四十二。可是它有点快。
0007/Happy/0007_000950.wav|我不用转头，不需要脖子。
0007/Happy/0007_000772.wav|资料全都不见了。气死我了。
0007/Happy/0007_001044.wav|很漂亮，不过人多拥挤。
0007/Happy/0007_000713.wav|周末的我，只忙着陪你。
0007/Happy/0007_001015.wav|我需要插着电源才能说话。
0007/Happy/0007_000903.wav|希望我有一天也可以去那里。
0007/Happy/0007_000836.wav|我喜欢几乎所有的运动，
0007/Happy/0007_000798.wav|我只会斗斗地主什么的。
0007/Happy/0007_000831.wav|吝啬鬼！他每天还骑自行车上学！
0007/Happy/0007_001036.wav|谢谢你的夸奖，鲍伯上年纪了。
0007/Happy/0007_001016.wav|每次你看到一些时尚衣物时，
0007/Happy/0007_000801.wav|很快，车就可自动开了。
0007/Happy/0007_000951.wav|没看过小说，只有人类才需要。
0007/Happy/0007_001032.wav|我想要那种新款的美国兵款式。
0007/Happy/0007_000884.wav|二零一六年十一月五号是星期六。
0007/Happy/0007_001001.wav|播放歌单收藏，脑筋可动得真快。
0007/Happy/0007_000797.wav|你女儿和她妈妈长得很像。
0007/Happy/0007_000829.wav|对别人没有，而对我就有。
0007/Happy/0007_000773.wav|她总是带香甜甜的微笑。
0007/Happy/0007_000804.wav|没有找到蒸鱼的计时。
0007/Happy/0007_000934.wav|它是一个主要的空气污染物。
0007/Happy/0007_000740.wav|是一家制药公司的短期工。
0007/Happy/0007_000785.wav|是啊，他的健康我总放心不下。
0007/Happy/0007_000727.wav|工厂不把它直接排到大气中。
0007/Happy/0007_000854.wav|我还不会说其他外语，只会普通话。
0007/Happy/0007_000981.wav|晚安，么么哒，满天都是小星星。
0007/Happy/0007_000786.wav|真想不到，游泳竟有如此多的好处，
0007/Happy/0007_000849.wav|你好，布赖恩，正好四点。
0007/Happy/0007_000715.wav|我特别喜欢网球和登山。
0007/Happy/0007_000719.wav|不就是你嘛，为什么要偷笑来。
0007/Happy/0007_000992.wav|哪天我也许得和他谈谈。
0007/Happy/0007_000936.wav|我不需要嗅觉，所以没有鼻子。
0007/Happy/0007_000844.wav|节食减肥很痛苦。
0007/Happy/0007_001031.wav|于是我就问她能不能连我的票买了。
0007/Happy/0007_000711.wav|妇女节快乐。我永远爱你，妈妈。
0007/Happy/0007_000974.wav|只要不违法，我还是想留下它。
0007/Happy/0007_001033.wav|错过这村可就没这个店了。
0007/Happy/0007_000915.wav|拜拜，明天要再来和小可爱聊天。
0007/Happy/0007_000898.wav|当然知道，我们各有千秋。
0007/Happy/0007_000989.wav|不会，不过我很喜欢单板滑雪。
0007/Happy/0007_000703.wav|我老家在北京。
0007/Happy/0007_000803.wav|感觉好温暖呀，好的，一会儿见。
0007/Happy/0007_001013.wav|旅行结束后我将休息一段时间。
0007/Happy/0007_000843.wav|女孩的心思你别猜，但是我不用猜。
0007/Happy/0007_001007.wav|有时内在美更加重要。
0007/Happy/0007_000919.wav|大部分都是用诱饵钓到的。
0007/Happy/0007_000814.wav|我也是，我还有点儿口渴。
0007/Happy/0007_000710.wav|个人收藏家！他们肯定有，
0007/Happy/0007_001002.wav|我希望你能和我一起想派对点子。
0007/Happy/0007_000923.wav|听起来你们玩得也很开心。
0007/Happy/0007_000794.wav|很神奇的样子，我搞不懂为什么。
0007/Happy/0007_000846.wav|现在，我仍然有点紧张。
0008/Happy/0008_001013.wav|旅行结束后我将休息一段时间。
0008/Happy/0008_000796.wav|别小看我这发型！我还蛮喜欢的。
0008/Happy/0008_000934.wav|它是一个主要的空气污染物。
0008/Happy/0008_000895.wav|我以为你们国家的人都是麻将高手。
0008/Happy/0008_000854.wav|我还不会说其他外语，只会普通话。
0008/Happy/0008_000938.wav|我不这么认为。我们沿着小溪走。
0008/Happy/0008_000984.wav|有充足的时间购物和观光。
0008/Happy/0008_000719.wav|不就是你嘛，为什么要偷笑来。
0008/Happy/0008_000886.wav|软妹子生气会说：讨厌，不理你啦。
0008/Happy/0008_000928.wav|好的。新的音乐厅有一场音乐会。
0008/Happy/0008_000953.wav|你比吴亦凡帅，我同意你的观点。
0008/Happy/0008_000909.wav|对不起我把咖啡洒在桌布上了。
0008/Happy/0008_000805.wav|我们俩合不来，还经常吵架。
0008/Happy/0008_000828.wav|这些颜色也不太适合你。
0008/Happy/0008_000744.wav|比方说，“华尔街日报”就很好。
0008/Happy/0008_001043.wav|许多白领都参加到这个游戏里面，
0008/Happy/0008_000912.wav|我还会陪你一路走下去。
0008/Happy/0008_001005.wav|我支持你。它是需要重做。
0008/Happy/0008_000766.wav|我们可以去钓鱼、聊天还有野营。
0008/Happy/0008_000983.wav|我想所有中国人都会打乒乓球。
0008/Happy/0008_000733.wav|我是青蛙，不用冬眠的。
0008/Happy/0008_000871.wav|你这个小气鬼，很不幸，非常少。
0008/Happy/0008_000907.wav|我是萌萌哒，你是呆呆哒。
0008/Happy/0008_000841.wav|你可以去问鹦鹉啊，鹦鹉会说话。
0008/Happy/0008_001011.wav|我们休息一下喝杯咖啡。
0008/Happy/0008_000827.wav|你说我们在芝加哥要待三天的。
0008/Happy/0008_000738.wav|当然是了，我现在快饿死了。
0008/Happy/0008_000749.wav|递给我一些彩球和纸花。
0008/Happy/0008_000829.wav|对别人没有，而对我就有。
0008/Happy/0008_000798.wav|我只会斗斗地主什么的。
0008/Happy/0008_000989.wav|不会，不过我很喜欢单板滑雪。
0008/Happy/0008_001023.wav|他对谁都那么友好。
