audio_file|text
0003/Happy/0003_000704.wav|不管怎么说主队好象是志在夺魁。
0003/Happy/0003_000743.wav|这样的话，我们可以选择青年旅馆。
0003/Happy/0003_000891.wav|别问了！说多了都是泪！
0003/Happy/0003_000747.wav|这是台湾地区最大的动物园。
0003/Happy/0003_000939.wav|食物也很美味，更不用提价钱了。
0003/Happy/0003_000717.wav|很快你上大学就用得到了。
0003/Happy/0003_000735.wav|这样无辜的人就不会被杀了。
0003/Happy/0003_000874.wav|他在这次竞选活动中花了数百万，
0003/Happy/0003_000984.wav|有充足的时间购物和观光。
0003/Happy/0003_001009.wav|已经怀孕四个半月了，
0003/Happy/0003_000913.wav|裁判全给了满分。
0003/Happy/0003_000948.wav|我不怎么在乎这个店有没有名。
0003/Happy/0003_000976.wav|我当然喜欢，我很注意颜面。
0003/Happy/0003_000945.wav|贾尼斯突然兴奋地大叫起来。
0003/Happy/0003_000879.wav|她和维克分手了，所以她申请转调。
0003/Happy/0003_000712.wav|你每次谈恋爱都像现在这样。
0003/Happy/0003_000885.wav|今天真凉快，我希望主队输掉。
0003/Happy/0003_000877.wav|你在我的心里折腾好久了。
0003/Happy/0003_000778.wav|它们的设计外形小巧，可单手操作。
0003/Happy/0003_000897.wav|为什么不，交朋友不分性别。
0003/Happy/0003_000827.wav|你说我们在芝加哥要待三天的。
0003/Happy/0003_000806.wav|做不了什么，通常我会保持沉默。
0003/Happy/0003_000996.wav|赌博往往是个祸根，
0003/Happy/0003_000724.wav|你的身影总是在我心里晃来晃去。
0003/Happy/0003_000964.wav|听起来很厉害的样子！
0003/Happy/0003_000956.wav|陪你度过这漫长的黑夜。
0003/Happy/0003_000892.wav|如果我滚远了就回不来了。
0003/Happy/0003_000759.wav|只要是我能玩好的，我都喜欢。
0003/Happy/0003_000820.wav|你还真是考虑周到。
0003/Happy/0003_000719.wav|不就是你嘛，为什么要偷笑来。
0003/Happy/0003_000856.wav|承蒙邀请参加你的婚礼。
0003/Happy/0003_000916.wav|碰到喜欢的女孩子要主动。
0003/Happy/0003_000893.wav|带女友出去好好吃上一顿。
0003/Happy/0003_000802.wav|我昨天遇到马克，他看起来很忧郁。
0003/Happy/0003_000959.wav|我们想等一个合适的时候。
0003/Happy/0003_000772.wav|资料全都不见了。气死我了。
0003/Happy/0003_000933.wav|拜托，别跟我提到笔记本电脑。
0003/Happy/0003_000835.wav|我要学习一下相关知识。
0003/Happy/0003_000811.wav|每天早晨都是我妈妈帮他系的。
0003/Happy/0003_001012.wav|如果她拒绝我，我会死的。
0003/Happy/0003_000831.wav|吝啬鬼！他每天还骑自行车上学！
0003/Happy/0003_000837.wav|也许能帮助你把事情弄清楚。
0003/Happy/0003_000929.wav|这个位置不错，下车。
0003/Happy/0003_000886.wav|软妹子生气会说：讨厌，不理你啦。
0003/Happy/0003_000854.wav|我还不会说其他外语，只会普通话。
0003/Happy/0003_000798.wav|我只会斗斗地主什么的。
0003/Happy/0003_000912.wav|我还会陪你一路走下去。
0003/Happy/0003_000832.wav|是你最牵挂的那个女人。
0003/Happy/0003_000744.wav|比方说，“华尔街日报”就很好。
0003/Happy/0003_000807.wav|我的表两点四十二。可是它有点快。
0003/Happy/0003_000785.wav|是啊，他的健康我总放心不下。
0003/Happy/0003_000909.wav|对不起我把咖啡洒在桌布上了。
0003/Happy/0003_000710.wav|个人收藏家！他们肯定有，
0003/Happy/0003_001045.wav|别总是闲着，找点事情干。
0003/Happy/0003_000906.wav|是的，我知道，患难见真情。
0003/Happy/0003_001016.wav|每次你看到一些时尚衣物时，
0003/Happy/0003_000849.wav|你好，布赖恩，正好四点。
0003/Happy/0003_000928.wav|好的。新的音乐厅有一场音乐会。
0003/Happy/0003_000950.wav|我不用转头，不需要脖子。
0003/Happy/0003_000853.wav|我们还等什么
0003/Happy/0003_000862.wav|原来你也在玩这个
0003/Happy/0003_001026.wav|这么多笑话，一天讲不完！
0003/Happy/0003_000768.wav|我应该给女朋友买玫瑰花的。
0003/Happy/0003_001013.wav|旅行结束后我将休息一段时间。
0003/Happy/0003_000781.wav|这个镇上所有的人都喜欢扯闲话。
0003/Happy/0003_000767.wav|你深深地印在我的脑海里。
0003/Happy/0003_000988.wav|我随时都在，有没有梦到我。
0003/Happy/0003_001038.wav|年轻人当然要承担责任，
0003/Happy/0003_000733.wav|我是青蛙，不用冬眠的。
0003/Happy/0003_000911.wav|我对养花已经厌倦了。
0003/Happy/0003_000872.wav|我是个学生，服务器响应超时。
0003/Happy/0003_000739.wav|没有找到日程，走的时候请锁门。
0003/Happy/0003_000800.wav|就经常去我们宿舍附近的酒吧。
0003/Happy/0003_000994.wav|我是银灰色的，我都被你说饿了。
0003/Happy/0003_000841.wav|你可以去问鹦鹉啊，鹦鹉会说话。
0003/Happy/0003_000773.wav|她总是带香甜甜的微笑。
0003/Happy/0003_000708.wav|沙尘暴好像给每个人都带来了麻烦！
0003/Happy/0003_000761.wav|下个月我姐姐就要结婚了。
0003/Happy/0003_000736.wav|我必须一直通电才能工作。
0003/Happy/0003_000833.wav|是不是依然觉得我很可爱。
0003/Happy/0003_000753.wav|我肯定会的，那以后我不问了。
0003/Happy/0003_000794.wav|很神奇的样子，我搞不懂为什么。
0003/Happy/0003_001042.wav|我缺钱用，所以上星期把它当了。
0003/Happy/0003_000981.wav|晚安，么么哒，满天都是小星星。
0003/Happy/0003_000949.wav|我最好的朋友就约会过。
0003/Happy/0003_000967.wav|这可是我学会的第一首古诗。
0003/Happy/0003_000745.wav|我知道人生并不总是一帆风顺，
0003/Happy/0003_000937.wav|雪下得真大，带着我去购物。
0003/Happy/0003_000786.wav|真想不到，游泳竟有如此多的好处，
0003/Happy/0003_000869.wav|让我再想想，真相已经上传了。
0003/Happy/0003_000732.wav|我遇到了一位漂亮的女孩。
0003/Happy/0003_001031.wav|于是我就问她能不能连我的票也买了。
0003/Happy/0003_000716.wav|他一定是一眼就被你迷住了。
0003/Happy/0003_000919.wav|大部分都是用诱饵钓到的。
0003/Happy/0003_000714.wav|谁你也不认识，我很乐意帮助你。
0003/Happy/0003_000946.wav|领带对男人来说真必不可少。
0003/Happy/0003_000944.wav|我的直系亲属人数不多。
0003/Happy/0003_000954.wav|我没有忽悠你，机器人不会忽悠。
0003/Happy/0003_001018.wav|下午好，蒂娜，我想我问错人了。
0003/Happy/0003_000866.wav|我想那些应该是草莓的种子。
0003/Happy/0003_000812.wav|那棒极了，其实心情挺不错。
0003/Happy/0003_001020.wav|谢谢你来这里，告诉我详细一些。
0003/Happy/0003_000850.wav|这样子比较有趣。
0003/Happy/0003_000867.wav|太妙了，我想换一些日元。
0003/Happy/0003_000740.wav|是一家制药公司的短期工。
0003/Happy/0003_000776.wav|是的，你是个大块头，我是守门员。
0003/Happy/0003_000836.wav|我喜欢几乎所有的运动，
0003/Happy/0003_001004.wav|我刚从苏格兰回来。
0003/Happy/0003_000955.wav|最初我的工作是当一名佣人。
0003/Happy/0003_000875.wav|她此刻失业了，你最好不要惹她。
0003/Happy/0003_000722.wav|我和我朋友刚从巴厘岛回来。
0003/Happy/0003_000789.wav|是个冰淇淋，桃花确实很漂亮。
0003/Happy/0003_000987.wav|我太喜欢听了，所以不断重复着听。
0003/Happy/0003_000962.wav|他好像是被他女友给甩了。
0003/Happy/0003_000889.wav|我是一名教师，你可是好眼光。
0003/Happy/0003_000930.wav|那不打扰你了，我不敢约出去。
0003/Happy/0003_001017.wav|你看上去比以前更漂亮了。
0003/Happy/0003_000974.wav|只要不违法，我还是想留下它。
0003/Happy/0003_000780.wav|看呀，我们差不多就装饰好了。
0003/Happy/0003_000922.wav|我的老朋友汉森就住在伦敦。
0003/Happy/0003_000727.wav|工厂不把它直接排到大气中。
0003/Happy/0003_000715.wav|我特别喜欢网球和登山。
0003/Happy/0003_000966.wav|我是淑女，只会讲文明用语。
0003/Happy/0003_000951.wav|没看过小说，只有人类才需要。
0003/Happy/0003_001050.wav|是很难听的脏话，主人可别学了。
0003/Happy/0003_001002.wav|我希望你能和我一起想派对点子。
0003/Happy/0003_000769.wav|以后不要喝那么多了，伤身体。
0003/Happy/0003_001033.wav|错过这村可就没这店了。
0003/Happy/0003_000931.wav|最近很冷，风又大。
0003/Happy/0003_000890.wav|上海现在是下午四点三十六分。
0003/Happy/0003_000870.wav|这样你就有时间挥拍打球了。
0003/Happy/0003_000982.wav|有些人划船，有的人在进行花草活动
0003/Happy/0003_000826.wav|不是，他住在沃斯盾的老房子里。
0003/Happy/0003_000760.wav|坐地铁只需要大约二十分钟。
0003/Happy/0003_000917.wav|他的收支几乎不能平衡。
0003/Happy/0003_000829.wav|对别人没有，而对我就有。
0003/Happy/0003_000852.wav|小心脚下。人行道上有个坑。
0003/Happy/0003_000846.wav|现在，我仍然有点紧张。
0003/Happy/0003_000965.wav|我必须再次感谢您的慷慨相助。
0003/Happy/0003_000777.wav|奏婚礼进行曲了，他们过来了。
0003/Happy/0003_000861.wav|他讲的笑话让我笑个不停。
0003/Happy/0003_000895.wav|我以为你们国家的人都是麻将高手。
0003/Happy/0003_000728.wav|没错，就是车门。另外两个人问他说
0003/Happy/0003_000792.wav|不会这么凑巧吧！我也是十六。
0003/Happy/0003_000953.wav|你比吴亦凡帅，我同意你的观点。
0003/Happy/0003_000723.wav|做一些好吃的促进宝宝的食欲。
0003/Happy/0003_000748.wav|时候不早了，我来了，请指示。
0003/Happy/0003_000711.wav|妇女节快乐。我永远爱你，妈妈。
0003/Happy/0003_000887.wav|我们一起为他办个惊喜派对。
0003/Happy/0003_000859.wav|我不会牺牲我的健康来换取金钱的。
0003/Happy/0003_000971.wav|很大，令人兴奋但是嘈杂。
0003/Happy/0003_000741.wav|姐忙得很，没空和你说这个。
0003/Happy/0003_001011.wav|我们休息一下喝杯咖啡。
0003/Happy/0003_000983.wav|我想所有中国人都会打乒乓球。
0003/Happy/0003_001027.wav|我讨厌吃醋，偶是不懂，你懂。
0003/Happy/0003_000942.wav|为了不让鱼吃掉诗人的身体。
0003/Happy/0003_000845.wav|听大自然的声响，就像听音乐一样！
0003/Happy/0003_000970.wav|没有找到你想删除的闹钟。
0003/Happy/0003_000883.wav|你绝对猜不到她准备要孩子了。
0003/Happy/0003_000770.wav|心动不如行动，我不太擅长卖萌。
0003/Happy/0003_000762.wav|我是顺路过来跟你告别的。
0003/Happy/0003_000986.wav|门儿都没有，现在还不会。
0003/Happy/0003_000839.wav|他们的配合值得我们学习
0003/Happy/0003_001044.wav|很漂亮，不过人多拥挤。
0003/Happy/0003_001043.wav|许多白领都参加到这个游戏里面，
0003/Happy/0003_001008.wav|我去查查篮球相关的知识。
0003/Happy/0003_000896.wav|我饿啦，我想去吃点东西。
0003/Happy/0003_000805.wav|我们俩合不来，还经常吵架。
0003/Happy/0003_000907.wav|我是萌萌哒，你是呆呆哒。
0003/Happy/0003_000985.wav|自己保重，记得要常联系。
0003/Happy/0003_000898.wav|当然知道，我们各有千秋。
0003/Happy/0003_001000.wav|这个我相信，我是登山爱好者。
0003/Happy/0003_000726.wav|是的，他很狡猾，经常陷害别人。
0003/Happy/0003_001010.wav|这局我让你开，今天我不想错过。
0003/Happy/0003_000957.wav|这是我在旅游第四天拍的。
0003/Happy/0003_000936.wav|我不需要嗅觉，所以没有鼻子。
0003/Happy/0003_000756.wav|我参加了一个有关全球变暖的集会，
0003/Happy/0003_000960.wav|我很伤心，我准备去网吧。
0018/Happy/0018_000842.wav|Wake now my merry tads!
0018/Happy/0018_000906.wav|Still you owe it a duty.
0018/Happy/0018_000975.wav|You shouldn't have pricked him with your horn.
0018/Happy/0018_000881.wav|First, issue a reward.
0018/Happy/0018_000913.wav|Let it give us a chance, my precious.
0018/Happy/0018_000776.wav|The hag looked in the stove.
0018/Happy/0018_000772.wav|How are you, dear child?
0018/Happy/0018_001000.wav|Six was half way down the room.
0018/Happy/0018_000956.wav|I must have two to fetch and carry.
0018/Happy/0018_000948.wav|In which piglet meets a elephant.
0018/Happy/0018_000974.wav|Because he was a man with infinite resource and sagacity.
0018/Happy/0018_000912.wav|No thank you.
0018/Happy/0018_000903.wav|I was not grabbed.
0018/Happy/0018_000992.wav|She has a high voice.
0018/Happy/0018_000779.wav|All my gum tips gone as well.
0018/Happy/0018_001019.wav|How could I dig burrows with short toe nails?
0018/Happy/0018_000761.wav|Midyear is day, shire year.
0018/Happy/0018_000936.wav|How rash you are!
0018/Happy/0018_000940.wav|Both side were softly curved.
0018/Happy/0018_000847.wav|And there you'll find a snap dragon fly.
0018/Happy/0018_000862.wav|I lent George three pounds.
0018/Happy/0018_000943.wav|And has you slain him?
0018/Happy/0018_000725.wav|She is now choosing skirt to wear.
0018/Happy/0018_000885.wav|The new born baby is stolen as we go.
0018/Happy/0018_000713.wav|I have bunburyed all over goat on two separate occasions.
0018/Happy/0018_000833.wav|I smell the breath of an English.
0018/Happy/0018_000834.wav|Rare rabbit had a little apron.
0018/Happy/0018_000734.wav|A divine wrath made her blue eyes awful.
0018/Happy/0018_000945.wav|Do you think it's a woozle?
0018/Happy/0018_000962.wav|I believe you are one of them!
0018/Happy/0018_000939.wav|This is the way that snakes always talk.
0018/Happy/0018_000984.wav|Chapter eighteen, the return journey.
0018/Happy/0018_000877.wav|Tom fell with a cloven head.
0018/Happy/0018_000911.wav|From each cake, there sprang a huge dog.
0018/Happy/0018_000846.wav|He said to Jack, the chatterer.
0018/Happy/0018_001017.wav|At length they came to a sharp bend.
0018/Happy/0018_000732.wav|Who is been repeating all that hard stuff to you?
0018/Happy/0018_000831.wav|It must come sometimes to jam a day.
0018/Happy/0018_000968.wav|He showed no signs of age.
0018/Happy/0018_001028.wav|It would be a hard choice.
0018/Happy/0018_000852.wav|Guilty for what do you rule?
0018/Happy/0018_000878.wav|And vowed he'd change the pigtail's place.
0018/Happy/0018_000977.wav|The end part is fish mouth.
0018/Happy/0018_000932.wav|Will call her Lily, for short.
0018/Happy/0018_000750.wav|Rabbit gave dog a hurrying up sort of nudge.
0018/Happy/0018_001038.wav|Paul's teeth ached because of lemon.
0018/Happy/0018_000969.wav|But show me now your map!
0018/Happy/0018_000907.wav|What am I, I'm a racer, son of god.
0018/Happy/0018_000743.wav|Story twenty nine a boy and a monkey.
0018/Happy/0018_000851.wav|All the way to China is home.
0018/Happy/0018_000796.wav|I don't painted tiger.
0018/Happy/0018_000857.wav|Blackbird, and Jay.
0018/Happy/0018_000996.wav|You woke me up!
0018/Happy/0018_000717.wav|Why has this egg not broken?
0018/Happy/0018_001040.wav|So Tom saw night as it were broad daylight.
0018/Happy/0018_000937.wav|What would they do at the end of the year?
0018/Happy/0018_001032.wav|where are you going?
0018/Happy/0018_000798.wav|Said the witch.
0018/Happy/0018_000978.wav|I know you .
0018/Happy/0018_000823.wav|I am from towel land.
0018/Happy/0018_001047.wav|What are you waiting for? man.
0018/Happy/0018_000816.wav|No, I burst the balloon!
0018/Happy/0018_001049.wav|What do you think of this question?
0018/Happy/0018_000785.wav|Suppose I take grandmother a fresh vegetable.
0018/Happy/0018_000867.wav|I toy with my liqueur.
0018/Happy/0018_000752.wav|From August eighteenth, of their divorce.
0018/Happy/0018_000917.wav|You cruelty shall cost your life !
0018/Happy/0018_000802.wav|This is Jack, the relatives of Tom.
0018/Happy/0018_000861.wav|That's a full grown colt.
0018/Happy/0018_000827.wav|Cos I know I had some honey.
0018/Happy/0018_000972.wav|No admittance except on party business.
0018/Happy/0018_000836.wav|She has eaten the tapioca all of it.
0018/Happy/0018_000897.wav|Fur flew through the air, teeth gnashed.
0018/Happy/0018_000775.wav|I'd far rather go without them than eat them!
0018/Happy/0018_000770.wav|Tom now let our arrows fly!
0018/Happy/0018_000845.wav|Reed by the living pool!
0018/Happy/0018_000980.wav|Your path now goes south.
0018/Happy/0018_000921.wav|I am a selfish sinner.
0018/Happy/0018_001021.wav|Called out the cloud.
0018/Happy/0018_000987.wav|A voice said: Come in.
0018/Happy/0018_000813.wav|Mister Lawson saw George last night.
0018/Happy/0018_000855.wav|This speech roused dame ilse to anger.
0018/Happy/0018_000706.wav|Andy what's the gyre and to gimble.
0018/Happy/0018_000910.wav|It weighs seven point five kilogram.
0018/Happy/0018_000721.wav|As rich as Peter's son in law!
0018/Happy/0018_000723.wav|I thought you meant how old are you?
0018/Happy/0018_000747.wav|please excuse me.
0018/Happy/0018_000812.wav|Clown, to call him joey.
0018/Happy/0018_000769.wav|Not much use is it, Sam?
0018/Happy/0018_000784.wav|By hook or by crook.
0018/Happy/0018_000967.wav|Chapter eleven on the doorstep.
0018/Happy/0018_000711.wav|Chapter ten a warm welcome.
0018/Happy/0018_000719.wav|At the end of four.
0018/Happy/0018_000982.wav|Alice I won't forget it again.
0018/Happy/0018_000964.wav|Slam the doors and wedge them!
0018/Happy/0018_000947.wav|She and i are running a neck and neck race.
0018/Happy/0018_000822.wav|Am I an absolute pauper?
0018/Happy/0018_001030.wav|She keeps saying I'm hers.
0018/Happy/0018_000880.wav|Toast from the bread fruit tree.
0018/Happy/0018_000966.wav|We may join with that power.
0018/Happy/0018_000900.wav|That cloth does not look worth much!
0018/Happy/0018_000730.wav|Must a name mean something?
0018/Happy/0018_000905.wav|Fear neither root nor sprout!
0018/Happy/0018_000998.wav|She come back to the valley.
0018/Happy/0018_000716.wav|Mister share man, I move for a division.
0018/Happy/0018_000710.wav|A nauseous draught.
0018/Happy/0018_000795.wav|Aha what i have we here?
0018/Happy/0018_000745.wav|The nastiest things they saw were the cobwebs.
0018/Happy/0018_001001.wav|I'm sure your friends can wait!
0018/Happy/0018_000751.wav|Said the American to Chinese.
0018/Happy/0018_001027.wav|It's part of my secret.
0018/Happy/0018_000780.wav|Then there was a report.
0018/Happy/0018_001042.wav|Why should I purchase my own?
0018/Happy/0018_001048.wav|Dear customer,welcome to our ship.
0018/Happy/0018_000703.wav|That I owe my thanks to you.
0018/Happy/0018_000971.wav|I say I will be emperor.
0018/Happy/0018_000790.wav|And they did push so!
0018/Happy/0018_000997.wav|How Tom and Jerry went to visit mister Sam.
0018/Happy/0018_000768.wav|I do not eat bread.
0018/Happy/0018_000914.wav|But what about this thing, sticky!
0018/Happy/0018_001034.wav|Another one, ten thousand dollars.
0018/Happy/0018_000950.wav|Her kind and firm glance.
0018/Happy/0018_000767.wav|I suppose no, it doesn't!
0018/Happy/0018_001018.wav|The name of the song is called haddocks.
0018/Happy/0018_000890.wav|And they were sandy yellow brownish all over.
0018/Happy/0018_000958.wav|Mum shuts one's mouth up, doesn't it.
0018/Happy/0018_000825.wav|To catch that bulrush root with my paw!
0018/Happy/0018_000789.wav|Let go of my top knot.
0018/Happy/0018_000888.wav|Now quicker the fiddle went.
0018/Happy/0018_000718.wav|Then sadly it is much farther.
0018/Happy/0018_000915.wav|He likes dragons very much.
0018/Happy/0018_000955.wav|This was the twenty fifth of November, seventeen eighty three.
0018/Happy/0018_000976.wav|Can your name be more hilarious?
0018/Happy/0018_000865.wav|They were going fast, with a light clip.
0018/Happy/0018_000965.wav|I've just shot a stag.
0018/Happy/0018_000994.wav|Now I understand.
0018/Happy/0018_000837.wav|Let the glass globe be.
0018/Happy/0018_000985.wav|The straw, charcoal and the pea.
0018/Happy/0018_000895.wav|A boat put out-on the bay.
0018/Happy/0018_000704.wav|They went up to the dark mass job had pointed out.
0018/Happy/0018_001037.wav|But mom I'm not certain about.
0018/Happy/0018_000701.wav|The nine the eggs, I keep.
0018/Happy/0018_001012.wav|Father has yellow eyes.
0018/Happy/0018_001004.wav|How do you like you dirty bird!
0018/Happy/0018_000736.wav|How I hate this foul pool!
0018/Happy/0018_000909.wav|A raging fire was in his eyes.
0018/Happy/0018_000819.wav|The owl flew into a bush.
0018/Happy/0018_000773.wav|how suspicious this fox.
0018/Happy/0018_000774.wav|Come on my jack in the boxes!
0018/Happy/0018_000942.wav|Give me your hand or I will cry harder than before.
0018/Happy/0018_000874.wav|I pay half a crown a week extra.
0018/Happy/0018_000817.wav|They were children of mine.
0018/Happy/0018_000892.wav|I have had to grow old.
0018/Happy/0018_000871.wav|I say neither yea nor nay.
0018/Happy/0018_000849.wav|My winding sheet!
0018/Happy/0018_001007.wav|I owe them five hundred dollars.
0018/Happy/0018_000853.wav|But we are not high yet.
0018/Happy/0018_000873.wav|He searched through the box.
0018/Happy/0018_000879.wav|Daisy creams with pink edges.
0018/Happy/0018_000938.wav|Today isn't any other day.
0018/Happy/0018_000983.wav|They had been named Tom and Jerry.
0018/Happy/0018_000882.wav|Age forty five if a day a lie.
0018/Happy/0018_000993.wav|He is old fashioned but he is the best of men.
0018/Happy/0018_000886.wav|She jump at the tail and bite it savagely.
0018/Happy/0018_001033.wav|You gain for nothing girl!
0018/Happy/0018_000809.wav|If they mother knew it.
0018/Happy/0018_000898.wav|I'd shoot myself. a pause.
0018/Happy/0018_001014.wav|Bob goes to a new school.
0018/Happy/0018_000995.wav|I know how to obey orders.
0018/Happy/0018_000859.wav|Such tunes are joy to a dancing fay.
0018/Happy/0018_000821.wav|Finn and the fairy shoemaker.
0018/Happy/0018_000981.wav|He could not help doing so.
0018/Happy/0018_000731.wav|All smile were real and the happier，the more sincere .
0018/Happy/0018_000868.wav|I said you looked like an egg, sir.
0018/Happy/0018_000838.wav|But one requires the explorer to furnish proofs.
0018/Happy/0018_000805.wav|He was killed by an arrow.
0018/Happy/0018_000707.wav|I'm as bad as I can be.
0018/Happy/0018_000724.wav|The football teams give a tea party.
0018/Happy/0018_001039.wav|And be with you,Tom!
0018/Happy/0018_000949.wav|You may imagine how I gape.
0018/Happy/0018_000944.wav|Off for the prison ship.
0018/Happy/0018_000889.wav|When such wanderers meet.
0018/Happy/0018_001020.wav|Goat Billy asked the old Chinese guy.
0018/Happy/0018_001044.wav|Lucy, a clever farmer.
0018/Happy/0018_001036.wav|Over them swooped the eagles.
0018/Happy/0018_000918.wav|I'll send for Tom to my boudoir.
0018/Happy/0018_000788.wav|In my opinion that is a good idea!
0018/Happy/0018_000715.wav|Poor Tom now is dead!
0018/Happy/0018_000979.wav|These words behind the ears is nonsense.
0018/Happy/0018_001011.wav|I am safe back again.
0018/Happy/0018_000754.wav|Are you a regular darkey really?
0018/Happy/0018_001003.wav|I am loath to see him go.
0018/Happy/0018_000989.wav|No, said piggy carelessly.
0018/Happy/0018_000815.wav|He might call it, for example.
0018/Happy/0018_000753.wav|He was still in the forest!
0018/Happy/0018_000893.wav|Please hire me after you.
0018/Happy/0018_000928.wav|It says no way! shouted Daisy.
0018/Happy/0018_000904.wav|The song is really louding on a gate.
0018/Happy/0018_000854.wav|He dreamt them all night.
0018/Happy/0018_000739.wav|Our thanks to God's oath.
0018/Happy/0018_000722.wav|And what are doves. And what are doves.
0018/Happy/0018_000760.wav|That I am a born nurse.
0018/Happy/0018_000766.wav|Shall we let Barbara in?
0018/Happy/0018_000901.wav|A lady, is on Alice's lap!
0018/Happy/0018_000872.wav|I shall say good bye.
0018/Happy/0018_000927.wav|Born once every one hundred years, dies in flames!
0018/Happy/0018_001008.wav|Perhaps you think that is a queer title for this chapter.
0018/Happy/0018_000931.wav|He told me that I ought to change.
0018/Happy/0018_000841.wav|Can I lodge here tonight?
0018/Happy/0018_000800.wav|Well anyhow it didn't rain, he said.
0018/Happy/0018_000887.wav|An hour out of GuildFord town.
0018/Happy/0018_000764.wav|And we are so thirsty!
0018/Happy/0018_000973.wav|I'd just as soon swim your way as others do.
0018/Happy/0018_000848.wav|And on the top of them, came Winnie, the cute bear.
0018/Happy/0018_001031.wav|She'll be feverish after so much thinking.
0018/Happy/0018_000714.wav|Annie please please don't hurt me!
0018/Happy/0018_000970.wav|Chew leaves quickly, said rabbit.
0018/Happy/0018_000755.wav|A deafening chirruping rent the air.
0018/Happy/0018_000963.wav|She said in subdued voice.
0018/Happy/0018_000758.wav|The octopus has eight legs.
0018/Happy/0018_000856.wav|The eye could not catch them.
0018/Happy/0018_000839.wav|Cuckoos is downheaded and crying.
0018/Happy/0018_000749.wav|Then we all say aha!
0018/Happy/0018_000783.wav|Be off now as quick as you may!
0018/Happy/0018_000759.wav|Zero four three a silver shilling is journey.
0018/Happy/0018_000748.wav|You are not a runaway,who are you?
0018/Happy/0018_001002.wav|Five hundred and one million right?
0018/Happy/0018_000870.wav|But if you hadn't done them.
0018/Happy/0018_000824.wav|You know, answers to the name of Tom's son.
0018/Happy/0018_001046.wav|I am going to back home.
0018/Happy/0018_000894.wav|Yes, I miss her.
